Title,Category Path,Category,Category ID,Type,Category Level,Heading Level
Fears,THEMES > Miscellaneous,Miscellaneous,no match,Story,2,3
Loves,THEMES > Miscellaneous,Miscellaneous,no match,Story,2,3
"What
was one of the toughest, easiest, best, worst parts about raising first,
second, third",THEMES > Miscellaneous,Miscellaneous,no match,Story,2,3
What makes you Scared?,THEMES > Miscellaneous,Miscellaneous,no match,Story,2,3
What makes you Happy?,THEMES > Miscellaneous,Miscellaneous,no match,Story,2,3
What makes you depressed?,THEMES > Miscellaneous,Miscellaneous,no match,Story,2,3
Who are your closest friends,THEMES > Miscellaneous,Miscellaneous,no match,Story,2,3
What are your Strengths,THEMES > Miscellaneous,Miscellaneous,no match,Story,2,3
"What simple pleasures of life do you truly
enjoy?",THEMES > Miscellaneous,Miscellaneous,no match,Story,2,3
"What successes/failures (mistakes) have you
made?",THEMES > Miscellaneous,Miscellaneous,no match,Story,2,3
What would you have done differently?,THEMES > Miscellaneous,Miscellaneous,no match,Story,2,3
"What is one of the craziest things that's
ever happened to you?",THEMES > Miscellaneous,Miscellaneous,no match,Story,2,3
"How has your life turned out differently
than you imagined it would?",THEMES > Miscellaneous,Miscellaneous,no match,Story,2,3
How has your worldview evolved?,THEMES > Reflection,World & Politics,no match,Story,2,3
What values remain constant?,THEMES > Reflection,Personal Reflection,no match,Reflection,2,3
What beliefs have changed?,THEMES > Reflection,Personal Reflection,no match,Reflection,2,3
What wisdom would you share?,THEMES > Reflection,Personal Reflection,no match,Reflection,2,3
What matters most now?,THEMES > Reflection,Personal Reflection,no match,Reflection,2,3
How do you define success?,THEMES > Reflection,Personal Reflection,no match,Reflection,2,3
What do you want to be remembered for?,THEMES > Legacy,Future,no match,Story,2,3
What values do you hope endure?,THEMES > Legacy,Future,no match,Story,2,3
What stories should be preserved?,THEMES > Legacy,Future,no match,Story,2,3
What wisdom should be shared?,THEMES > Legacy,Future,no match,Story,2,3
What traditions should continue?,THEMES > Legacy,Future,no match,Story,2,3
What impact do you hope to have?,THEMES > Legacy,Future,no match,Story,2,3
What dreams remain?,THEMES > Legacy,Future,no match,Story,2,3
What matters most?,THEMES > Legacy,Future,no match,Story,2,3
What risks paid off?,THEMES > Personal,Personal Reflection,no match,Reflection,2,3
What principles guided choices?,THEMES > Personal,Personal Reflection,no match,Reflection,2,3
What influenced decisions?,THEMES > Personal,Personal Reflection,no match,Reflection,2,3
What wisdom surprised you?,THEMES > Personal,Personal Reflection,no match,Reflection,2,3
What relationships matter most?,THEMES > Personal,Personal Reflection,no match,Reflection,2,3
What joys sustain you?,THEMES > Personal,Personal Reflection,no match,Reflection,2,3
What were your biggest lessons?,THEMES > Personal,Personal Reflection,no match,Reflection,2,3
What would you do differently?,THEMES > Personal,Personal Reflection,no match,Reflection,2,3
What choices proved best?,THEMES > Personal,Personal Reflection,no match,Reflection,2,3
What challenges taught you most?,THEMES > Personal,Personal Reflection,no match,Reflection,2,3
What wisdom surprised you?,THEMES > Personal,Personal Reflection,no match,Reflection,2,3
What advice would you give?,THEMES > Personal,Personal Reflection,no match,Reflection,2,3
What principles guide you?,THEMES > Personal,Personal Reflection,no match,Reflection,2,3
What major changes have you witnessed?,THEMES > Era Overview,Personal Reflection,no match,Reflection,2,3
How has society evolved?,THEMES > Era Overview,Personal Reflection,no match,Reflection,2,3
What progress encourages you?,THEMES > Era Overview,Personal Reflection,no match,Reflection,2,3
What concerns remain?,THEMES > Era Overview,Personal Reflection,no match,Reflection,2,3
What wisdom has history taught?,THEMES > Era Overview,Personal Reflection,no match,Reflection,2,3
What cycles repeat?,THEMES > Era Overview,Personal Reflection,no match,Reflection,2,3
What changes surprise?,THEMES > Era Overview,Personal Reflection,no match,Reflection,2,3
How has culture changed?,THEMES > Era Overview,Personal Reflection,no match,Reflection,2,3
What values shifted?,THEMES > Era Overview,Personal Reflection,no match,Reflection,2,3
What traditions endure?,THEMES > Era Overview,Personal Reflection,no match,Reflection,2,3
What wisdom emerged?,THEMES > Era Overview,Personal Reflection,no match,Reflection,2,3
What changes challenge?,THEMES > Era Overview,Personal Reflection,no match,Reflection,2,3
What progress encourages?,THEMES > Era Overview,Personal Reflection,no match,Reflection,2,3
What concerns remain?,THEMES > Era Overview,Personal Reflection,no match,Reflection,2,3
What changes do you foresee?,THEMES > Era Overview,Personal Reflection,no match,Reflection,2,3
What hopes do you hold?,THEMES > Era Overview,Personal Reflection,no match,Reflection,2,3
What concerns you?,THEMES > Era Overview,Personal Reflection,no match,Reflection,2,3
What wisdom might help?,THEMES > Era Overview,Personal Reflection,no match,Reflection,2,3
What should endure?,THEMES > Era Overview,Personal Reflection,no match,Reflection,2,3
What should change?,THEMES > Era Overview,Personal Reflection,no match,Reflection,2,3
What matters most?,THEMES > Era Overview,Personal Reflection,no match,Reflection,2,3
What political changes affected you?,THEMES > Historical Events,World & Politics,no match,Story,2,3
What economic conditions shaped choices?,THEMES > Historical Events,World & Politics,no match,Story,2,3
What technological changes occurred?,THEMES > Historical Events,World & Politics,no match,Story,2,3
Has Life been good to you?,THEMES > Blessings,Personal Reflection,no match,Reflection,2,3
What were your surpirses,THEMES > Blessings,Personal Reflection,no match,Reflection,2,3
What are your regrets?,THEMES > Blessings,Personal Reflection,no match,Reflection,2,3
What mistakes have you made?,THEMES > Blessings,Personal Reflection,no match,Reflection,2,3
What would you do differently?,THEMES > Blessings,Personal Reflection,no match,Reflection,2,3
"What advice would you give your 20, 30, 40, 50, 60 year old self?",THEMES > Advice,Personal Reflection,no match,Reflection,2,3
How have you become wiser?,THEMES > Advice,Personal Reflection,no match,Reflection,2,3
What are your thoughts on the issues of the day?,THEMES > Issues,World & Politics,no match,Story,2,3
Social and Cultural Topics,THEMES > Issues,World & Politics,no match,Story,2,3
Governance and Global Relations,THEMES > Issues,World & Politics,no match,Story,2,3
Toughest/easiest,"THEMES > My Children > William,
Elizabeth, and Caroline",Children,no match,Story,3,4
Science and Technology,The Decades > The 1960�s > Society & Culture,The 1960's,no match,Story,3,4
The 1970�s,The Decades,The Decades,no match,Story,1,2
